{
  "space": {
    "id": "memory-agent-zhouce",
    "scopeType": "agent_long_term",
    "scopeKey": {
      "kind": "agent_long_term",
      "agentId": "zhouce"
    },
    "stewardAgentId": "zhouce",
    "reviewPolicy": "independent_reviewer",
    "visibilityPolicy": "agent_private",
    "storageLocator": {
      "rootKind": "managed",
      "displayPath": "memory/long-term.md",
      "relativePath": "memory/long-term.md"
    },
    "currentRevisionId": "memory-revision-17",
    "contentHash": "sha256:aaaaaaaaaaaaaaaaaaaaaaaaaaaaaaaaaaaaaaaaaaaaaaaaaaaaaaaaaaaaaaaa",
    "updatedAt": "2026-09-01T00:00:00Z",
    "owner": {
      "kind": "agent",
      "agentId": "zhouce"
    },
    "storageProfileVersion": "memory-v1",
    "state": "active",
    "reviewPrincipal": {
      "kind": "agent",
      "agentId": "zhiheng"
    }
  },
  "candidate": {
    "id": "memory-candidate-18",
    "spaceId": "memory-agent-zhouce",
    "proposerAgentId": "zhouce",
    "source": {
      "kind": "manual",
      "label": "Agent 详情"
    },
    "summary": "补充长期交付约定",
    "proposedContent": "# 长期记忆\n\n交付必须附验证证据。\n",
    "proposedContentHash": "sha256:bbbbbbbbbbbbbbbbbbbbbbbbbbbbbbbbbbbbbbbbbbbbbbbbbbbbbbbbbbbbbbbb",
    "submittedBaseline": {
      "id": "memory-baseline-17",
      "assetId": "memory-agent-zhouce",
      "containerId": "memory-agent-zhouce",
      "assetContentHash": "sha256:aaaaaaaaaaaaaaaaaaaaaaaaaaaaaaaaaaaaaaaaaaaaaaaaaaaaaaaaaaaaaaaa",
      "containerContentHash": "sha256:aaaaaaaaaaaaaaaaaaaaaaaaaaaaaaaaaaaaaaaaaaaaaaaaaaaaaaaaaaaaaaaa"
    },
    "status": "pending_review",
    "version": 1,
    "createdAt": "2026-09-01T00:01:00Z",
    "updatedAt": "2026-09-01T00:01:00Z",
    "reviewPrincipal": {
      "kind": "agent",
      "agentId": "zhiheng"
    }
  },
  "reviewRequest": {
    "requestId": "memory-review-request-18",
    "candidateId": "memory-candidate-18",
    "decision": "approve",
    "expectedCandidateVersion": 1,
    "expectedBaseline": {
      "id": "memory-baseline-17",
      "assetId": "memory-agent-zhouce",
      "containerId": "memory-agent-zhouce",
      "assetContentHash": "sha256:aaaaaaaaaaaaaaaaaaaaaaaaaaaaaaaaaaaaaaaaaaaaaaaaaaaaaaaaaaaaaaaa",
      "containerContentHash": "sha256:aaaaaaaaaaaaaaaaaaaaaaaaaaaaaaaaaaaaaaaaaaaaaaaaaaaaaaaaaaaaaaaa"
    },
    "comment": "审核通过",
    "expectedReviewPrincipal": {
      "kind": "agent",
      "agentId": "zhiheng"
    }
  },
  "savedResult": {
    "kind": "saved",
    "requestId": "memory-review-request-18",
    "candidate": {
      "id": "memory-candidate-18",
      "spaceId": "memory-agent-zhouce",
      "proposerAgentId": "zhouce",
      "source": {
        "kind": "manual",
        "label": "Agent 详情"
      },
      "summary": "补充长期交付约定",
      "proposedContent": "# 长期记忆\n\n交付必须附验证证据。\n",
      "proposedContentHash": "sha256:bbbbbbbbbbbbbbbbbbbbbbbbbbbbbbbbbbbbbbbbbbbbbbbbbbbbbbbbbbbbbbbb",
      "submittedBaseline": {
        "id": "memory-baseline-17",
        "assetId": "memory-agent-zhouce",
        "containerId": "memory-agent-zhouce",
        "assetContentHash": "sha256:aaaaaaaaaaaaaaaaaaaaaaaaaaaaaaaaaaaaaaaaaaaaaaaaaaaaaaaaaaaaaaaa",
        "containerContentHash": "sha256:aaaaaaaaaaaaaaaaaaaaaaaaaaaaaaaaaaaaaaaaaaaaaaaaaaaaaaaaaaaaaaaa"
      },
      "status": "written",
      "version": 2,
      "createdAt": "2026-09-01T00:01:00Z",
      "updatedAt": "2026-09-01T00:02:00Z",
      "reviewPrincipal": {
        "kind": "agent",
        "agentId": "zhiheng"
      }
    },
    "decision": {
      "id": "memory-decision-18",
      "candidateId": "memory-candidate-18",
      "decision": "approve",
      "comment": "审核通过",
      "decidedAt": "2026-09-01T00:02:00Z",
      "actorPrincipal": {
        "kind": "agent",
        "agentId": "zhiheng"
      }
    },
    "revision": {
      "id": "memory-revision-18",
      "spaceId": "memory-agent-zhouce",
      "parentRevisionId": "memory-revision-17",
      "candidateId": "memory-candidate-18",
      "reviewDecisionId": "memory-decision-18",
      "proposerAgentId": "zhouce",
      "sourceContentHash": "sha256:aaaaaaaaaaaaaaaaaaaaaaaaaaaaaaaaaaaaaaaaaaaaaaaaaaaaaaaaaaaaaaaa",
      "contentHash": "sha256:bbbbbbbbbbbbbbbbbbbbbbbbbbbbbbbbbbbbbbbbbbbbbbbbbbbbbbbbbbbbbbbb",
      "storageLocator": {
        "rootKind": "managed",
        "displayPath": "memory/long-term.md",
        "relativePath": "memory/long-term.md"
      },
      "writeReceiptId": "memory-write-18",
      "writtenAt": "2026-09-01T00:02:00Z",
      "reviewPrincipal": {
        "kind": "agent",
        "agentId": "zhiheng"
      }
    },
    "writeReceipt": {
      "id": "memory-write-18",
      "containerId": "memory-agent-zhouce",
      "previousContainerHash": "sha256:aaaaaaaaaaaaaaaaaaaaaaaaaaaaaaaaaaaaaaaaaaaaaaaaaaaaaaaaaaaaaaaa",
      "writtenContainerHash": "sha256:bbbbbbbbbbbbbbbbbbbbbbbbbbbbbbbbbbbbbbbbbbbbbbbbbbbbbbbbbbbbbbbb",
      "verifiedAt": "2026-09-01T00:02:00Z",
      "atomicReplace": true
    }
  }
}
